{
  "schema_version": "0.6.1",
  "reference_id": "phase10_6_foundation_arm_landmarks",
  "source_profile_sha256": "a197399a6897eaf8b9bf620a01694813d8ad50bb38cc6fba865aa7424d0e6475",
  "source_glb_sha256": "a162d8730238a76ba1d6b31910c98fb1f5640c46917983e0bbad04095e81b7b2",
  "coordinate_space": "body_relative",
  "position_unit": "standing_height",
  "poses": {
    "bras_bas": {
      "left_shoulder": [
        0.10040356357194591,
        0.4029441803223254,
        -0.018564206393507563
      ],
      "left_elbow": [
        0.1338513390993375,
        0.23585479751435695,
        0.013844024768706942
      ],
      "left_wrist": [
        0.01328368512801231,
        0.11576958300835959,
        0.06243375695145712
      ],
      "left_hand": [
        2.3928495334541856e-18,
        0.10731632883598813,
        0.07088701112382859
      ],
      "right_shoulder": [
        -0.10040356357194591,
        0.4029441803223254,
        -0.018564206393507563
      ],
      "right_elbow": [
        -0.1338513390993375,
        0.23585479751435695,
        0.013844024768706942
      ],
      "right_wrist": [
        -0.01328368512801231,
        0.11576958300835959,
        0.06243375695145712
      ],
      "right_hand": [
        -2.3928495334541856e-18,
        0.10731632883598813,
        0.07088701112382859
      ]
    },
    "en_avant": {
      "left_shoulder": [
        0.10040356357194591,
        0.4029441803223254,
        -0.018564206393507563
      ],
      "left_elbow": [
        0.12983220615008761,
        0.3797279907703459,
        0.15079597936641848
      ],
      "left_wrist": [
        0.005026793699562685,
        0.3473043206813807,
        0.271999505064759
      ],
      "left_hand": [
        8.973185750453196e-18,
        0.3455090372172511,
        0.2890546979739895
      ],
      "right_shoulder": [
        -0.10040356357194591,
        0.4029441803223254,
        -0.018564206393507563
      ],
      "right_elbow": [
        -0.12983220615008761,
        0.3797279907703459,
        0.15079597936641848
      ],
      "right_wrist": [
        -0.005026793699562685,
        0.3473043206813807,
        0.271999505064759
      ],
      "right_hand": [
        -8.973185750453196e-18,
        0.3455090372172511,
        0.2890546979739895
      ]
    },
    "second": {
      "left_shoulder": [
        0.10040356357194591,
        0.4029441803223254,
        -0.018564206393507563
      ],
      "left_elbow": [
        0.27139202413853536,
        0.41701889294763955,
        0.006984918826836659
      ],
      "left_wrist": [
        0.4254685260054949,
        0.3299704132454062,
        0.007971708907190319
      ],
      "left_hand": [
        0.44188356846954685,
        0.3249745307563469,
        0.012967591396249605
      ],
      "right_shoulder": [
        -0.10040356357194591,
        0.4029441803223254,
        -0.018564206393507563
      ],
      "right_elbow": [
        -0.27139202413853536,
        0.41701889294763955,
        0.006984918826836659
      ],
      "right_wrist": [
        -0.4254685260054949,
        0.3299704132454062,
        0.007971708907190319
      ],
      "right_hand": [
        -0.44188356846954685,
        0.3249745307563469,
        0.012967591396249605
      ]
    }
  }
}
